imagen,codigo,articulo,descripcion,precio
45,ANILLO DE UÑA,Plateado,Anillo de uña Con Diseño De Flor.,$7.99
48,ANILLO DE UÑA,estilo 2 / Plateado,Anillo De Uñas De Cobre Y Circonita de mariposa,$7.99
49,ANILLO DE UÑA,Plata,Anillo ajustables para Uñas. Varios diseños a escoger,$7.99
50,ANILLO,Plateado,"Anillo con diseño de luna y sol, anillo decorativo de circonita.",$9.99
52,ANILLO DE UÑA,Blanco,"Anillo de uñas de aleación para mujeres, accesorio de moda, anillo de uñas para los dedos, joyería punk, encanto para fiestas de chicas",$7.99
53,ANILLO DE UÑA,Amarillo dorado / Dedo índice,Anillo ajustable para uñas.,$7.99
54,ANILLO DE UÑA,Paquete De 4 Anillos Abiertos Dorados Para Damas,Anillo ajustable para uñas. Varios diseños a escoger.,$7.99
56,ANILLO DE UÑA,Hueco,Anillo para uñas. Varios tamaños a escoger,$7.99
57,ANILLO DE UÑA,Plateado,Anillo ajustable para uñas.,$7.99