imagen,codigo,descripcion,articulo,precio
9,TOA009,"Tobillera Minimalista Con Anillo Para El Dedo Del Pie.
Disponible en color: dorado y plateado.",Plateado,$9.99
88,TOA0088,"Tobillera de cuentas con anillo, cierre ajustable.",Plateado,$9.99
89,TOB0089,Tobillera De Cadena Con Perlas,Dorado,$5.99
90,TOB0090,"Tobillera De Cadena Fina Con Colgante bañada En Oro, varios modelos a escoger.",Dorado,$4.99
91,TOB0091,Tobillera De Cadena Con Pedrería,B-0126 Dorado,$5.99
92,TOA0092,"Tobillera con anillo, Con Perlas, cierre ajustable.",Dorado,$9.99
93,TOB0093,Tobillera de Margaritas,Margarita,$5.99
94,TOA0094,Tobillera con anillo de cadena con cuentas. Disponible en color: dorado y plateado.,Plateado / Talla única,$9.99
133,TOB00133,"Tobillera De Cadena Con Pedrería. Varios modelos a escoger: Perla, mariposa, corazón, cadena gruesa y cadena simple.",Dorado,$4.99